ID,,TEXT,Types,Related to,Is about,Is about,Is about,Author
,,"Risk Mitigation Funds
Mitigation funds are accessed when there is excessive damage done to a unit beyond what the security deposit will pay. <...> just having this added protection in place can be a game changer when asking landlords to rent to someone that they consider “high risk,” such as people with a poor rental history, low or no income, and/or past involvement with the criminal justice system. ",Claim,,Housing,Landlords,Finance,U.S. Interagency Council on Homelessness
,,"Availability of Neutral Mediators
A mediator responds to landlord/tenant concerns and helps to resolve conflicts. Both parties often win in this scenario, as evictions are costly and landlords would often prefer to avoid them. The neutral mediator can be the difference between a housing resolution and homelessness. ",Claim,,Housing,Landlords,,U.S. Interagency Council on Homelessness
,,"Flexible Funds. In many cases, federal subsidies are restricted to certain uses, and vouchers may only cover a portion of expenses associated with connecting a tenant to housing. Flexible funds can be utilized for movers, deposits, rent, or inspections.",Claim,,Housing,Landlords,Finance,U.S. Interagency Council on Homelessness
,,"Landlord and Tenant Education
Providers may offer classes or one-on-one coaching for both landlords and tenants on issues such as rights and responsibilities, fair housing, and financial management. This can often be provided by a HUD approved housing counseling agency. ",Claim,,Housing,Landlords,,U.S. Interagency Council on Homelessness
,,"To end homelessness in America, we must strengthen our ability to prevent it in the first place",Claim,,Big picture,Prevention,,U.S. Interagency Council on Homelessness
,,"Reduce the risk of housing crises. Communities must address the wide range of policies contributing to the availability of, and access to, an adequate supply of safe and affordable housing; health and behavioral health resources; education and meaningful and gainful employment; opportunities for economic mobility; affordable child care; and legal assistance.",Claim,,Prevention,,,U.S. Interagency Council on Homelessness
,,"Individuals or families are often engaged with multiple public systems, such as health and behavioral health care, child welfare, and the juvenile and criminal justice systems, prior to experiencing homelessness.",Claim,Make different institutions coordinate their actions on solving homelessness,Big picture,Coordination,,U.S. Interagency Council on Homelessness
,,"Public systems must work together to increase awareness of and attentiveness to housing stability, as well as strengthen their transition and/or discharge planning activities that link people to other resources, including employment and other economic mobility supports.",Claim,Make different institutions coordinate their actions on solving homelessness,Big picture,Coordination,,U.S. Interagency Council on Homelessness
,,"Communities can also consider policies that increase access to home-visiting programs, family support networks, school-based supports, and other community-based programs that focus on strong families and positive youth development.",Claim,,Big picture,,,U.S. Interagency Council on Homelessness
,,"Family preservation and reunification can also be explored, whenever safe and appropriate, in order to address the disproportionate impact of homelessness on single mothers and youth of color.",Claim,,Groups,,,U.S. Interagency Council on Homelessness
,,"<Target assistance> Family preservation and reunification can also be explored, whenever safe and appropriate, in order to address the disproportionate impact of homelessness on single mothers and youth of color.",Claim,,Big picture,,,U.S. Interagency Council on Homelessness
,,"To end homelessness, we must quickly identify and engage individuals and families that experience it, including people who are sheltered and those who are unsheltered, in locations such as cars, parks, abandoned buildings, encampments, or on the street.",Claim,,Big picture,Outreach,,U.S. Interagency Council on Homelessness
,,"Many individuals experiencing homelessness are disengaged from—and may be distrustful of—public and private programs, agencies, and systems, and they may be reluctant to seek assistance",Claim,,Support,,,U.S. Interagency Council on Homelessness
,,"Helping individuals to overcome these barriers <of distrust based reluctance to seek assistance> often requires significant outreach time and effort, and can take months or even years of proactive and creative engagement to build trust.",Claim,,Outreach,Big picture,,U.S. Interagency Council on Homelessness
,,"Communities can use housing-focused coordinated outreach to people who are unsheltered, in-reach to people in institutional settings, data from multiple systems, and other methods to identify and engage individuals and families experiencing homelessness, in conjunction with coordinated entry processes and other systems.",Claim,,Outreach,Coordination,Data,U.S. Interagency Council on Homelessness
,,"<Communities need the capacity> to identify every individual and family who is unsheltered, in shelter, or in transitional housing settings or other residential programs, and to implement robust efforts to identify at-risk households",Claim,,Big picture,Data,,U.S. Interagency Council on Homelessness
,,"<Communities need the capacity to> coordinate a comprehensive set of strategies that collect information and data from hospitals, jails, schools, the child welfare system, hotlines and 2-1-1, and other community-based programs",Claim,Make different institutions coordinate their actions on solving homelessness,Data,Coordination,,U.S. Interagency Council on Homelessness
,,"<Communities need the capacity to> use HMIS and other data sources to build and maintain active lists of people experiencing homelessness and to track the homelessness status, engagements, and permanent housing placement for each individual or family",Claim,,Data,,,U.S. Interagency Council on Homelessness
,,"In order to comprehensively identify and engage all people experiencing homelessness, partnerships across multiple systems and sectors are critically important, particularly among homelessness service systems and health and behavioral health care providers, schools, early childhood care providers and other educators, child welfare agencies, Temporary Assistance for Needy Families (TANF) agencies, law enforcement, criminal justice system stakeholders, workforce systems, faith-based organizations, and other community-based partners.",Claim,,Outreach,Coordination,,U.S. Interagency Council on Homelessness
,,An effective crisis response system helps individuals and families experiencing homelessness avoid the need to enter emergency shelter whenever possible.,Claim,,Big picture,Shelters,,U.S. Interagency Council on Homelessness
,,"<An effective crisis response system> is also able to immediately provide a meaningful array of high-quality, housing-focused shelter or other temporary options for those living in unsafe situations, including those fleeing domestic violence and human trafficking and those living in unsheltered locations.",Claim,,Big picture,,,U.S. Interagency Council on Homelessness
,,Provide access to low-barrier emergency shelter. Communities should have effective models of emergency shelter and other temporary accommodations available/,Claim,,Big picture,Shelters,,U.S. Interagency Council on Homelessness
,,"<Emergency shelter and other temporary accommodations should> meet the needs of all members of a household and self-defined family and kinship groups, including infants and young children",Claim,,Shelters,Shelters,,U.S. Interagency Council on Homelessness
,,"<Emergency shelter and other temporary accommodations should> Do not turn people away or make access contingent on sobriety, minimum income requirements, or lack of a criminal history",Claim,,Shelters,,,U.S. Interagency Council on Homelessness
,,<Emergency shelter and other temporary accommodations should> Do not require family members and partners to separate from one another in order to access shelter,Claim,,Shared Housing,,,U.S. Interagency Council on Homelessness
,,<Emergency shelter and other temporary accommodations should> Ensure that policies and procedures promote dignity and respect for every person seeking or needing shelter,Claim,,Shelters,Big picture,,U.S. Interagency Council on Homelessness
,,"<Emergency shelter and other temporary accommodations should> Provide a safe, decent, welcoming, and appropriate temporary living environment, where daily needs can be met while pathways back to safe living arrangements or directly into housing programs are being pursued",Claim,,Shelters,Big picture,,U.S. Interagency Council on Homelessness
,,"Provide access to service-enriched, longer-term temporary accommodations when needed and appropriate",Claim,,Big picture,,,U.S. Interagency Council on Homelessness
,,"Longer-term temporary accommodations with a high level of supportive services, such as transitional housing programs, are typically more costly, but may fill a need for households with more intensive service needs.",Claim,,Longer-term temporary accommodation,Shelters,,U.S. Interagency Council on Homelessness
,,"Use standardized assessment tools, prioritization policies, and practices to take into account the unique needs of different populations",Claim,,Big picture,,,U.S. Interagency Council on Homelessness
,,"Build capacity to train staff consistently, to implement trauma-informed approaches, and to protect the confidentiality and safety concerns of people experiencing homelessness",Claim,,Service workers,Big picture,,U.S. Interagency Council on Homelessness
,,Bring non-traditional partners and resources to the table as part of a broad and collaborative community effort that engages other public programs and community- and faith-based organizations in preventing and ending homelessness.,Claim,,Big picture,Coordination,,U.S. Interagency Council on Homelessness
,,<Housing first> Housing First system orientation recognizes that people experiencing homelessness—like all people—need the safety and stability of a home in order to best address challenges and pursue opportunities.,Claim,House homeless people first before addressing underlying causes,Housing First,Housing,,U.S. Interagency Council on Homelessness
,,"The Housing First approach connects people back to a home as quickly as possible, while making readily available the services that people may need to be stable and secure.",Claim,House homeless people first before addressing underlying causes,Housing First,Housing,,U.S. Interagency Council on Homelessness
,,"<Housing first> street outreach providers, emergency shelters, and other parts of the crisis response system are working closely with housing providers to connect people to permanent housing as quickly as possible.",Claim,,Housing,Housing First,,U.S. Interagency Council on Homelessness
,,<Housing first> the community has a data-driven coordinated assessment system for matching people experiencing homelessness to the most appropriate housing and services based on their needs.,Claim,,Housing,Housing First,,U.S. Interagency Council on Homelessness
,,"<Housing first> the community has a unified and streamlined process for applying for rapid re-housing, supportive housing, and/or other housing interventions.",Claim,,Housing,Housing First,,U.S. Interagency Council on Homelessness
,,<Housing first> community leaders work collaboratively to ensure that a range of affordable and supportive housing options and models are available to meet local needs.,Claim,,Housing,Housing First,,U.S. Interagency Council on Homelessness
,,"<Housing first> policies and regulations related to supportive housing, social and health services, benefit and entitlement programs, and other essential services do not create needless barriers to housing.",Claim,,Housing,Housing First,,U.S. Interagency Council on Homelessness
,,<Housing first> communities work to ensure that people are not evicted back into homelessness whenever possible.,Claim,,Housing,Big picture,,U.S. Interagency Council on Homelessness
,,Thriving communities need enough housing that is affordable and equitably available to people across a full range of incomes—from young adults just starting out to seniors who want to spend their remaining years feeling secure,Claim,There is not enough affordable housing,Big picture,Housing,,U.S. Interagency Council on Homelessness
,,Expanding access to housing affordable to people who are at risk of or are experiencing homelessness.,Claim,,Big picture,Housing,,U.S. Interagency Council on Homelessness
,,"Promote development of an expanded supply of safe and affordable rental homes through federal, state, and local efforts and investments.",Claim,,Housing,,,U.S. Interagency Council on Homelessness
,,Assisting communities that are working to adopt policies to expand overall housing supply and to project the scale of affordable housing units—including units that are affordable to people exiting homelessness and units that are accessible to persons with disabilities—needed to meet local demand on an ongoing basis.,Claim,,Housing,Coordination,,U.S. Interagency Council on Homelessness
,,Improve access to federally funded housing assistance by eliminating administrative barriers and encouraging targeting and prioritization of affordable housing to people experiencing homelessness in a community and/or to populations that are especially vulnerable to homelessness.,Claim,,Housing,Housing,,U.S. Interagency Council on Homelessness
,,"Encourage collaboration between public housing agencies, multi-family housing owners, and homelessness services systems, and promote guidance on how public housing agencies and multi-family housing owners can adopt admissions preferences and successfully house people exiting homelessness.",Claim,,Housing,Coordination,,U.S. Interagency Council on Homelessness
,,Support states and communities to better target and align rental assistance and capital financing sources to support new construction and rehabilitation of affordable housing units that can be effectively accessed by people exiting homelessness.,Claim,,Housing,,,U.S. Interagency Council on Homelessness
,,Rapid re-housing is an intervention designed to help individuals and families that don't need intensive and ongoing supports to quickly exit homelessness and return to permanent housing.,Claim,,Rapid re-housing,Housing,,U.S. Interagency Council on Homelessness
,,"Rapid re-housing assistance is offered without preconditions — like employment, income, absence of criminal record, or sobriety — and the resources and services provided are tailored to the unique needs of the household.",Claim,,Rapid re-housing,Housing,,U.S. Interagency Council on Homelessness
,,"<Rapid Re-Housing, housing identification> recruit landlords to provide housing opportunities for individuals and families experiencing homelessness.",Claim,,Rapid re-housing,Housing,,U.S. Interagency Council on Homelessness
,,"<Rapid Re-Housing, housing identification> address potential barriers to landlord participation such as concern about short term nature of rental assistance and tenant qualifications.",Claim,,Rapid re-housing,Housing,,U.S. Interagency Council on Homelessness
,,"<Rapid Re-Housing, housing identification> assist households to find and secure appropriate rental housing.",Claim,,Rapid re-housing,Housing,,U.S. Interagency Council on Homelessness
,,"<Rapid Re-Housing, rent and Move-In Assistance>  Provide assistance to cover move-in costs, deposits, and the rental and/or utility assistance (typically six months or less) necessary to allow individuals and families to move immediately out of homelessness and to stabilize in permanent housing.",Claim,,Rapid re-housing,Housing,,U.S. Interagency Council on Homelessness
,,"<Rapid Re-Housing, Case Management and Services>  Help individuals and families experiencing homelessness identify and select among various permanent housing options based on their unique needs, preferences, and financial resources.",Claim,,Rapid re-housing,Housing,,U.S. Interagency Council on Homelessness
,,"<Rapid Re-Housing, Case Management and Services>  Help individuals and families experiencing homelessness address issues that may impede access to housing (such as credit history, arrears, and legal issues).",Claim,,Rapid re-housing,Housing,,U.S. Interagency Council on Homelessness
,,"<Rapid Re-Housing, Case Management and Services>  Help individuals and families negotiate manageable and appropriate lease agreements with landlords.",Claim,,Rapid re-housing,Housing,Landlords,U.S. Interagency Council on Homelessness
,,"<Rapid Re-Housing, Case Management and Services> Make appropriate and time-limited services and supports available to families and individuals to allow them to stabilize quickly in permanent housing.",Claim,,Rapid re-housing,Housing,,U.S. Interagency Council on Homelessness
,,"<Rapid Re-Housing, Case Management and Services> Monitor participants’ housing stability and be available to resolve crises.",Claim,,Rapid re-housing,Housing,,U.S. Interagency Council on Homelessness
,,"<Rapid Re-Housing, Case Management and Services> Provide or assist the household with connections to resources that help them improve their safety and well-being and achieve their long-term goals.",Claim,,Rapid re-housing,Housing,,U.S. Interagency Council on Homelessness
,,"<Rapid Re-Housing, Case Management and Services> Ensure that services provided are client-directed, respectful of individuals’ right to self-determination, and voluntary.",Claim,,Rapid re-housing,Housing,,U.S. Interagency Council on Homelessness
,,Communities must work to reduce the length of time families remain homeless by helping them obtain permanent housing as quickly as possible.,Claim,,Big picture,Housing,,U.S. Interagency Council on Homelessness
,,"Rapid re-housing may be a preferable part of the homeless crisis response system than more costly, service-intensive programs that have higher barriers to entry like transitional housing.",Claim,,Housing,Rapid re-housing,,U.S. Interagency Council on Homelessness
,,"The core components of rapid re-housing include (1) housing search and landlord negotiation, (2) short-term financial and rental
assistance, and (3) the delivery of home-based housing stabilization services, as needed.
",Claim,,Rapid re-housing,Housing,,U.S. Interagency Council on Homelessness
,,"<2015> Currently, most communities fund their rapid re-housing capacity by relying upon federal resources that are targeted to addressing homelessness, such as the
Emergency Solutions Grants, Continuum of Care program, or Supportive Services for Veteran Families funding",Claim,,Rapid re-housing,Housing,,U.S. Interagency Council on Homelessness
,,"There are many sources of federal assistance that communities can use to fund the three core components of rapid re-housing. These include resources administered by mainstream public systems like human services agencies, child welfare agencies, and housing agencies, who all play a key role in efforts to end homelessness.",Claim,,Rapid re-housing,Housing,,U.S. Interagency Council on Homelessness
,,"Supportive housing combines non-time-limited affordable housing assistance with wrap-around supportive services for people experiencing homelessness, as well as other people with disabilities.",Claim,Provide additional support on top of housing homeless people,Supportive housing,Housing,,U.S. Interagency Council on Homelessness
,,"Study after study has shown that supportive housing not only resolves homelessness and increases housing stability, but also improves health and lowers public costs by reducing the use of publicly-funded crisis services, including shelters, hospitals, psychiatric centers, jails, and prisons.",Claim,Provide additional support on top of housing homeless people,Big picture,Housing,Supportive housing,U.S. Interagency Council on Homelessness
,,"Supportive housing links decent, safe, affordable, community-based housing with flexible, voluntary support services designed to help the individual or family stay housed and live a more productive life in the community.",Claim,,Supportive housing,Housing,,U.S. Interagency Council on Homelessness
,,"There is no single model for supportive housing’s design. Supportive housing may involve the renovation or construction of new housing, set-asides of apartments within privately-owned buildings, or leasing of individual apartments dispersed throughout an area",Claim,Provide additional support on top of housing homeless people,Supportive housing,Housing,,U.S. Interagency Council on Homelessness
,,"Purpose-built or single-site housing: Apartment buildings designed to primarily serve tenants who are formerly homeless or who have service needs, with the support services typically available on site.",Claim,,Housing,,,U.S. Interagency Council on Homelessness
,,Scattered-site housing: People who are no longer experiencing homelessness lease apartments in private market or general affordable housing apartment buildings using rental subsidies. They can receive services from staff who can visit them in their homes as well as provide services in other settings.,Claim,,Housing,,,U.S. Interagency Council on Homelessness
,,"Unit set-asides: Affordable housing owners agree to lease a designated number or set of apartments to tenants who have exited homelessness or who have service needs, and partner with supportive services providers to offer assistance to tenants.",Claim,,Housing,,,U.S. Interagency Council on Homelessness
,,"People who experience homelessness often access hospital services in ways that are costly and avoidable and do
not resolve their underlying health crises",Claim,,Health,,,U.S. Interagency Council on Homelessness
,,Help people enroll in Medicaid if they are uninsured.,Claim,,Big picture,Health,,U.S. Interagency Council on Homelessness
,,"Hospitals that implement presumptive eligibility programs
can immediately enroll patients who are likely eligible under a state’s Medicaid eligibility guidelines for a
temporary period of time, based on information provided by the individual",Claim,,Health,,,U.S. Interagency Council on Homelessness
,,"Hospitals can also implement or
partner with benefits advocacy services, such as SAMHSA's SSI/SSDI Outreach, Access, and Recovery (SOAR)
program, to assist patients with establishing eligibility for Medicaid, as well as other benefits like SSI/SSDI.",Claim,Make different institutions coordinate their actions on solving homelessness,Health,,,U.S. Interagency Council on Homelessness
,,"Hospitals should recognize housing/homelessness status as a “vital sign” that should be integrated into routine screening when vulnerable
patients visit a hospital.",Claim,,Health,,,U.S. Interagency Council on Homelessness
,,"Hospitals can encourage the consistent use of the ICD-10 (International Classification of Diseases, Tenth Revision)
diagnosis code for homelessness (Z59.0) in medical records, making it easier to use hospital data to identify
patients who experience homelessness, plan for appropriate discharge and care coordination, and better
understand the needs, costs, and patterns of service use for these patients.",Claim,Make different institutions coordinate their actions on solving homelessness,Health,,,U.S. Interagency Council on Homelessness
,,"Health care and homelessness assistance systems speak different languages, and there are
important differences in how these systems offer help to people in need",Claim,,Coordination,Health,,U.S. Interagency Council on Homelessness
,,"When communities prioritize the most vulnerable people and those experiencing
chronic homelessness for housing assistance, hospitals and health care systems can partner with coordinated
entry systems to connect their most vulnerable patients to housing options.",Claim,Make different institutions coordinate their actions on solving homelessness,Big picture,Health,Coordination,U.S. Interagency Council on Homelessness
,,"People experiencing homelessness often have serious and complex health challenges, including mental health problems and substance use disorders, chronic medical conditions like diabetes and hypertension, and infectious diseases like HIV/AIDS, Hepatitis C, and tuberculosis.",Claim,,Big picture,Health,,U.S. Interagency Council on Homelessness
,,Ensuring access to quality health care must be a part of community’s response to homelessness.,Claim,,Big picture,Health,,U.S. Interagency Council on Homelessness
,,"Health care can be most effective when it is integrated with housing assistance, as stable housing not only improves health in and of itself, but also serves as a platform for consistently delivering health care and services.",Claim,,Health,Housing,,U.S. Interagency Council on Homelessness
,,"Encouraging housing providers and health and behavioral health care providers to co-locate, coordinate, or integrate health, behavioral health, safety, and wellness services with housing, and creating better resources for providers to connect patients to housing resources.",Claim,,Health,Big picture,,U.S. Interagency Council on Homelessness
,,"Testing new, and building upon successful, care and service delivery models to provide services in the homes of people who have experienced homelessness, including Assertive Community Treatment Teams and Home and Community Based Services for those with behavioral health needs.",Claim,,Big picture,Health,,U.S. Interagency Council on Homelessness
