ID,,TEXT,Types,Related to,Is about,Is about,Is about,Author
,,"<Compared with other major U.S. cities, S.F> suffers from unusually high rates of property crimes, such as theft and burglary.",Claim,,Crime,,,San Francisco Chronicle
,,"In 2020, the reported violent crime rate in San Francisco was 21% below the average of 20 most populous cities other than San Francisco for which there was full 2020 data available.",Claim,,Crime,,,San Francisco Chronicle
,,<2020> San Francisco property crime rate was 41% above average <of 20 most populous cities other than San Francisco>,Claim,,Crime,,,San Francisco Chronicle
,,"With the exception of robberies, violent crime in San Francisco is below average for large cities",Claim,,Crime,,,San Francisco Chronicle
,,"In 2019 and 2020, San Francisco ranked in the bottom half among major U.S. cities, with rates of 670 and 540 violent crime incidents per 100,000 residents, respectively.",Claim,,Crime,,,San Francisco Chronicle
,,San Francisco violent crime rate has declined significantly since the early 1990s – a trend that is consistent with the rest of the state.,Claim,,Crime,,,San Francisco Chronicle
,,Anti-gun violence initiatives in S.F. may have contributed to this trend <of violent crime decline since 1990>,Claim,,Crime,Cause,,San Francisco Chronicle
,,"According to Magnus Lofstrom, senior researcher at the Public Policy Institute of California, changing drug markets, more police officers, increased incarceration, an aging population and economic growth are potential factors for this decline <of statewide violent crime rate since 1990>",Claim,,Crime,Cause,,San Francisco Chronicle
,,Researchers have found that economic disadvantage and income inequality contribute to high rates of violent crime increases,Claim,,Crime,Finance,,San Francisco Chronicle
,,"San Francisco is an unusually wealthy city, with relatively few people in living poverty, which is likely a contributing factor to the city’s relatively low rates of reported violent crime.",Claim,,Finance,Crime,,San Francisco Chronicle
,,"In 2020, San Francisco was in the top three cities with the highest property crime.",Claim,,Crime,Statistics,,San Francisco Chronicle
,,"In 2019, the city ranked number one for property crimes among the major cities.",Claim,,Crime,Statistics,,San Francisco Chronicle
,,"<2019> agencies reported 5,500 incidents of burglary, larceny-theft, motor vehicle theft or arson per 100,000 San Franciscans.",Claim,,Crime,Statistics,,San Francisco Chronicle
,,Data in 2020 shows that the city’s burglary rate was 67% above the average of 20 other major cities.,Claim,,Crime,Statistics,,San Francisco Chronicle
,,"<San Francisco is both a tourist destination and a commuter city> this could be contributing to San Francisco high rates of theft-related crime. For example, tourists and commuters are particularly vulnerable to car break-ins.",Claim,,Crime,Cause,,San Francisco Chronicle
,,"The number of commuters and tourists has been lower in <San Francisco> since the start of the pandemic, <but property crime rate> remains unusually high",Claim,,Crime,,,San Francisco Chronicle
,,Researchers think that San Francisco high levels of economic inequality could be a contributing factor to the city’s high rates of property crime.,Claim,,Crime,Cause,,San Francisco Chronicle
,,"In July 2022, the Chronicle asked 1,653 San Francisco residents which problem in the city needed to be addressed most urgently. Crime and public safety were the second most common answer, after homelessness.",Claim,,Big picture,Statistics,,San Francisco Chronicle
,,"<July 2022, the Chronicle survey 1,653 San Francisco residents which problem in the city needed to be addressed most urgently>. When broken down by race, respondents who identify as Asian were the most likely to cite safety and crime as the most urgent issue in San Francisco. Black respondents were the least likely to say crime and safety, but were the most likely to say homelessness.",Claim,,Groups,Statistics,,San Francisco Chronicle
,,"Many San Franciscans are critical of the city’s police, according to a Chronicle survey.",Claim,,Crime,Police,,San Francisco Chronicle
,,"When asked to evaluate police performance in the city, 41% of survey respondents said the police have done a poor or very poor job at making San Francisco a better place to live and work in the last three years. Only 18% said they were doing an excellent or good job.
",Claim,,Crime,Police,,San Francisco Chronicle
,,"The police received the most favorable responses from Hispanic respondents, with 21% saying the police have done an excellent or good job in the last three years.",Claim,,Crime,Groups,Police,San Francisco Chronicle
,,San Franciscans may have reason to be displeased with police performance. A decade of data shows that property crime clearance rates in San Francisco have been decreasing since 2014.,Claim,,Crime,Police,,San Francisco Chronicle
,,"Burglary cases <in San Francisco> are the most common type of property crime to be cleared, though rates were on the decline in 2020.",Claim,,Crime,,,San Francisco Chronicle
,,"<In San Francisco> Clearance rates for thefts decreased the most since 2014, whereas motor vehicle theft clearances saw the most improvement.
",Claim,,Crime,,,San Francisco Chronicle
,,"Compared to 19 other cities for which there is data, San Francisco clearance rate for overall property crime ranks in the bottom half at just over 6%.",Claim,,Crime,,,San Francisco Chronicle
,,"Violent crimes are more likely to be cleared than property crimes, however San Francisco still ranks relatively low <compared to other cities>",Claim,,Crime,,,San Francisco Chronicle
,,The large number of car break-ins might be a driving factor in San Francisco low clearance rates for property crime.,Claim,,Crime,,,San Francisco Chronicle
,,PPIC crime researcher Lofstrom said car break-ins are notoriously difficult to solve.,Claim,,Crime,,,San Francisco Chronicle
,,"The Department of Housing and Urban Development, Department of Health and Human Services, and the Department of Veterans Affairs consider a person to be homeless if they are sleeping outside, in a place not meant for human habitation such as a car or abandoned building, or in an emergency shelter or transitional housing program. Other federal agencies have different definitions for homelessness.",Claim,,,Description,,National Alliance to End Homelessness
,,"Main reason people become homeless is because they cannot find housing they can afford. Other factors can include a chronic health condition, domestic violence and systemic inequality.",Claim,,Big picture,Cause,,National Alliance to End Homelessness
,,"To end homelessness, the nation will need an adequate supply of housing that is affordable to lower income households.",Claim,,Big picture,Housing,,National Alliance to End Homelessness
,,But the housing shortage and rising rents in communities across the nation are direct threats to the progress we’ve made <on homelessness>,Claim,There is not enough affordable housing,Housing,Big picture,,National Alliance to End Homelessness
,,Shared Housing is a strategy that maximizes housing resources in a community to get people housed quickly and reduce system strain.,Claim,,Housing,Shared Housing,,National Alliance to End Homelessness
,,"Sharing housing is often used as a response to a lack of affordable housing, as it reduces the rent burden for all parties involved – tenants, landlords, and the homelessness system itself.",Claim,,Housing,Shared Housing,,National Alliance to End Homelessness
,,"Progressive Engagement is a strategy to maximize a community’s limited resources by tailoring assistance to each household’s unique strengths, needs, and changing circumstances, and scaling them up or down as needed over time.",Claim,,Big picture,Progressive engagement,,National Alliance to End Homelessness
,,"Housing First is a philosophy rooted in the understanding that the most effective way to end a person’s homelessness is to connect them with permanent housing as fast as possible, without unnecessary preconditions, while offering on-going support through connection to optional services.",Claim,House homeless people first before addressing underlying causes,Housing First,Housing,Description,National Alliance to End Homelessness
,,"Shared housing is NOT a lesser option. Living with other people – especially when transitioning out of homelessness – has extraordinary social, mental, and emotional benefits. It also is a more affordable option than renting an entire unit on one’s own.",Claim,,Housing,Shared Housing,,National Alliance to End Homelessness
,,"Shared housing is an affordable housing model in which a person experiencing
homelessness lives with two or more people in one permanent housing unit, sharing the
rent and utilities. Each person living in the unit is listed on the lease.",Claim,,Shared Housing,Housing,Description,National Alliance to End Homelessness
,," <Shared housing> often involves working closely with people experiencing homelessness to help match them with potential
housemates, negotiating with landlords, and consistently engaging with all parties to
ensure that the arrangement is appropriate.",Claim,,Shared Housing,Housing,,National Alliance to End Homelessness
,,"Shared housing is a critical solution that addresses the lack of affordable housing. A
crisis most affecting those who are extremely low income and people experiencing
homelessness.",Claim,,Housing,Shared Housing,,National Alliance to End Homelessness
,,"The shared housing model increases affordable housing options and allows
for multiple people experiencing homelessness to access housing at once — which both
benefits people experiencing homelessness (can access housing more quickly) and the
homelessness system itself (more people, housed more quickly creates less strain on the
system due to increased outflow).",Claim,,Housing,Shared Housing,,National Alliance to End Homelessness
,,"Along with alleviating someone’s financial burden <shared housing> also provides
many benefits such as strengthening social support networks and accessing resources, such
as food, childcare, and other essential resources, that may previously have been unavailable.",Claim,,Housing,Shared Housing,,National Alliance to End Homelessness
,,"In many cases, shared housing works best when the strengths of each
person or household complement the other’s needs.",Claim,,Shared Housing,Housing,,National Alliance to End Homelessness
,,"Example 1: a senior with a low-fixed income could live in shared housing with a lowincome family. If the senior does not have any income, they can provide childcare or
other agreed upon services in lieu of rent. This can alleviate the burden of childcare
costs on the family and provide affordable, permanent housing to the senior. ",Claim,,Shared Housing,Housing,,National Alliance to End Homelessness
,,"Example 2: A young adult with no income could live in shared housing with a low,
fixed-income senior and offer in-home living support for the senior in exchange for
renting a room in their home. In this scenario, if the homeless young adult is working
with a homeless system program (coordinated access, shelter, rapid re-housing
program, etc), diversion, rapid exit, rapid re-housing, or other funds can be utilized to
assist the young adult with paying for training to provide in-home assistance/care to
the senior.",Claim,,Shared Housing,Housing,,National Alliance to End Homelessness
,,"A successful shared housing arrangement involves good communication — including
roommate/housemate agreements, budgeting parameters, conflict resolution strategies,
support from landlords, and additional support from service providers as needed.",Claim,,Shared Housing,Housing,,National Alliance to End Homelessness
,,"Effective shared housing uses roommate matching considerations to ensure that all tenants can
live in an environment that best suits their own strengths and needs. Some of those
components may include noise level in the unit, substance use, and visitors to the unit.",Claim,,Shared Housing,Housing,,National Alliance to End Homelessness
,,"Progressive engagement is an approach to quickly ending homelessness for a household
that considers their tenant or housing stabilization barriers, and utilizes the minimal
financial and support resources as is necessary. It is considered a person-centered
approach, as it is based on tailoring assistance to each household’s strengths and needs. ",Claim,,Progressive engagement,Description,,National Alliance to End Homelessness
,,"Progressive engagement
is a practice and a philosophy, rather than a strategy for specific program types or a
program in itself.",Claim,,Progressive engagement,Description,,National Alliance to End Homelessness
,,"<Progressive engagement> At a household’s first touch point with the homelessness system, staff engage in a
problem-solving conversation to identify the household’s strengths and most immediate
needs for services. From this initial conversation, staff will assess which light-touch
interventions (such as information and connection to resources, warm handoffs to
community partners, or small financial assistance) can be utilized to resolve the
household’s housing crisis",Claim,,Progressive engagement,Description,,National Alliance to End Homelessness
,,"The key to a successful progressive engagement approach is to consistently employ
these problem-solving conversations throughout the household’s experience within the
homelessness response system. As their circumstances change and their strengths are
identified, supports are adjusted throughout their pathway to permanent housing",Claim,,Progressive engagement,,,National Alliance to End Homelessness
,,"<Progressive engagement > This approach provides an opportunity for providers to individualize approaches, ensuring
the right amount of assistance meets a household’s needs at a given time. Progressive
engagement is an efficient approach, in that it avoids providing more assistance than
is needed;",Claim,,Big picture,Progressive engagement,,National Alliance to End Homelessness
,,"<Progressive Engagement> approach allows systems to tailor resources and services to the unique experiences of each household, as opposed
to a one-size-fits-all approach where too little or more assistance than is needed can be given.",Claim,,Big picture,Progressive engagement,,National Alliance to End Homelessness
,,"Housing First does not require people experiencing homelessness to address their problems before they can
access housing, including behavioral health problems, or graduating through a series of services programs.",Claim,House homeless people first before addressing underlying causes,Housing First,Description,,National Alliance to End Homelessness
,,"Housing First has been found to be particularly effective approach to end homelessness for highly vulnerable populations, such as chronically homeless
individuals.",Claim,House homeless people first before addressing underlying causes,Chronically homeless,Housing First,Housing,National Alliance to End Homelessness
,,"Housing First also promotes racial equity, in that in that it removes judgement from the providers
as to who is “deserving” of permanent housing - which can be riddled with bias against people of color. 
",Claim,House homeless people first before addressing underlying causes,Groups,Housing,Housing First,National Alliance to End Homelessness
,,There is a large evidence base demonstrating that Housing First is an effective solution to homelessness.,Claim,House homeless people first before addressing underlying causes,Housing,Housing First,,National Alliance to End Homelessness
,,Consumers in a Housing First model access housing faster and are more likely to remain stably housed,Claim,House homeless people first before addressing underlying causes,Housing,Housing First,,National Alliance to End Homelessness
,,"Providing access to housing generally results in cost savings for communities because housed people are less likely to use emergency services, including hospitals, jails, and emergency shelter, than those who are homeless.",Claim,,Big picture,Housing,,National Alliance to End Homelessness
,,"One study found an average cost savings on emergency services of $31,545 per person housed in the course of two years. Another study showed that a Housing First approach can cost up to $23,000 less per consumer per year than a shelter program. Housing First is not only cost efficient, but it also reduces the trauma households face due to homelessness.",Claim,House homeless people first before addressing underlying causes,Housing,Housing First,Shelters,National Alliance to End Homelessness
,,Federal housing assistance: Federal housing programs are one of the most successful housing-based solutions to reduce homelessness.,Claim,,Big picture,Federal housing assistance,Housing,Coalition for the Homeless
,,"The two largest federal housing programs are public housing and federal housing vouchers, known as Housing Choice Vouchers or Section 8 vouchers.",Claim,Rent public housing and issue housing vouchers to homeless people,Big picture,Housing,Federal housing vouchers,Coalition for the Homeless
,,Housing vouchers allow low-income households to rent modest market-rate housing of their choice and provide a flexible subsidy that adjusts with the family’s income over time,Claim,,Housing vouchers,Housing,Description,Coalition for the Homeless
,,Studies show that public housing and federal housing vouchers are highly successful at reducing family homelessness and in ensuring that these families remain stably housed out of the shelter system.,Claim,Rent public housing and issue housing vouchers to homeless people,Public housing,Public housing,Housing vouchers,Coalition for the Homeless
,,Permanent supportive housing has now proven to be a successful and cost-effective solution to the homelessness crisis.,Claim,Provide additional support on top of housing homeless people,Big picture,Permanent supportive housing,,Coalition for the Homeless
,,"The supportive housing model combines affordable housing assistance with vital support services for individuals living with mental illness, HIV/AIDS or other serious health problems.",Claim,Provide additional support on top of housing homeless people,Supportive housing,,Description,Coalition for the Homeless
,,"Moreover, numerous research studies have shown that permanent supportive housing costs less than other forms of emergency and institutional care.",Claim,Provide additional support on top of housing homeless people,Big picture,Permanent supportive housing,,Coalition for the Homeless
,,"The landmark 1990 City-State “New York/New York Agreement,” which has been renewed twice, is the premier example of a permanent supportive housing initiative that successfully reduced homelessness in New York City and saved taxpayer dollars that would otherwise have been spent on costly shelters and hospitalizations.",Claim,,Big picture,Permanent supportive housing,,Coalition for the Homeless
,,"The “housing first” approach involves moving long-term street homeless individuals — the majority of whom are living with mental illness, substance abuse disorders and other serious health problems — directly into subsidized housing and then linking them to support services, either on-site or in the community.",Claim,House homeless people first before addressing underlying causes,Housing,,,Coalition for the Homeless
,,Research studies have found that the majority of long-term street homeless people moved into “housing first” apartments remain stably housed and experience significant improvements in their health problems,Claim,House homeless people first before addressing underlying causes,Housing,,,Coalition for the Homeless
,,"Much like permanent supportive housing, the “housing first” approach is far less costly than emergency and institutional care, such as shelters, hospitals and correctional facilities.",Claim,House homeless people first before addressing underlying causes,Big picture,Housing First,Housing,Coalition for the Homeless
,,The fundamental cause of homelessness is the widening housing affordability gap.,Claim,There is not enough affordable housing,Big picture,Housing,,Coalition for the Homeless
,,One essential approach to reducing homelessness is to prevent it. Another is to ensure that formerly homeless families and individuals can maintain housing stability.,Claim,,Big picture,Prevention,,Coalition for the Homeless
,,One successful approach <to preventing homelessness> involves eviction-prevention grants to help tenants at risk of becoming homeless pay back rent and remain in their apartments.,Claim,,Housing,Prevention,,Coalition for the Homeless
,,Another successful approach to homelessness prevention involves legal services for low-income tenants in housing court.,Claim,,Housing,Prevention,,Coalition for the Homeless
,,"In New York City, more than 90 percent of tenants in housing court do not have legal representation, while nearly all landlords have lawyers.",Claim,,Big picture,,,Coalition for the Homeless
,,Programs that provide legal representation in housing court for low-income tenants facing eviction have proven to be successful and cost-effective. Most tenants assisted by these legal services programs are able to remain in their homes and avoid the costly shelter system.,Claim,,Housing,Prevention,,Coalition for the Homeless
,,"Effective discharge planning that includes housing assistance can help youth who are aging out of foster care, or low-income people living with mental illness who are leaving hospitals, or people exiting correction institutions, avoid homelessness.",Claim,,Big picture,Effective discharge planning,Housing assistance,Coalition for the Homeless
,,"support services <...> can include services like job training, child care and community-based counseling services.",Claim,,Support,,,Coalition for the Homeless
,,"More fundamentally, enhancing housing stability for poor and low-income renters involves broader policy changes including living-wage jobs; access to affordable health care; and adequate public benefits for people living with disabilities.",Claim,,Housing,,,Coalition for the Homeless
,,"The Fact is the major cause of homelessness is the severe lack of affordable housing, both in New York City and across the United States. By every measure, the housing affordability gap — that is, the gap between incomes and housing costs — has grown dramatically over the past four decades.",Claim,There is not enough affordable housing,Big picture,,Housing,Coalition for the Homeless
,,"The Fact is that people become homeless for many reasons, from loss of a job or lowered wages, to a health care crisis, increased rent, a family emergency, or even landlord bullying.",Claim,,Big picture,Cause,,Coalition for the Homeless
,,"Homelessness is driven by systemic factors like the lack of affordable housing and institutional racism, not personal failings.",Claim,,Big picture,Cause,,Coalition for the Homeless
,,The Fact is the majority of homeless New Yorkers are homeless because they cannot afford housing.,Claim,,Big picture,Housing,,Coalition for the Homeless
,,<In New York> only a small percentage of adults in homeless families have serious mental illnesses and/or substance use disorders.,Claim,,,Health,,Coalition for the Homeless
,,"For homeless single adults and those who are unsheltered, the rates of mental illnesses and substance use disorders are higher.",Claim,,,Health,,Coalition for the Homeless
,,"Phones and the internet are critical to securing and maintaining employment or housing. With ever-advancing technology, it is imperative that this vulnerable group not be left behind.",Claim,,Employment,,,Coalition for the Homeless
,,"Municipal shelters can be very difficult places to live for those people who have languished on the streets for years. Shelters are tight quarters with many rules and regulations, which can be confusing.",Claim,,Big picture,Shelters,,Coalition for the Homeless
,,"Nearly all municipal shelters <New York> for homeless single adults have barracks-style dormitories with as many as 100 beds in a single room, and these arrangements often do not suit the needs of homeless people living with serious mental illnesses like PTSD or mood disorders.",Claim,,Health,Shelters,,Coalition for the Homeless
,,Private market landlords are critical partners in the work to help people quickly exit homelessness.,Claim,,Housing,Landlords,,U.S. Interagency Council on Homelessness
,,"Centralized Hotline
A centralized program, like this one in Washington, offers a single access point for landlords and agencies seeking to connect currently available units to individuals and families holding vouchers and in search of housing. A strong practice includes employing a single 24/7 hotline, so that landlords can reach someone quickly when a unit becomes available or if they need to speak to a staff person because a tenant needs assistance.",Claim,,Housing,Landlords,,U.S. Interagency Council on Homelessness
,,"Housing Search Assistance
Having someone on staff who can outreach to and build relationships with landlords as their primary job function can be a strong asset in landlord engagement. This person, who may be called a housing locator, is usually not a case manager. He or she typically engages in tasks such as negotiating a lease, participating in unit inspections, etc.",Claim,,Housing,Landlords,,U.S. Interagency Council on Homelessness
