ID,,TEXT,Types,Related to,Is about,Is about,Is about,Author
,,"Following two years of decreases, there was an uptick of nearly 7,000 temporary shelter beds between 2019 and 2021 . Currently, the overall number of temporary beds is 8 percent lower than the all-time high count which occurred in 2011.",Claim,,,Shelters,,The National Alliance to End Homelessness
,,"In examining national-level bed and population counts for 2020, systems only had enough year-round beds for 50 percent of individuals on the night of the PiT Count.",Claim,,Shelters,,,The National Alliance to End Homelessness
,,"During the winter months, some communities temporarily supplement these year-round beds with seasonal ones.",Claim,,Shelters,Cold weather,,The National Alliance to End Homelessness
,,"CoCs have had recent years in which temporary housing offerings were on the decline while investments in permanent housing beds (Permanent Supportive Housing, Rapid Re-Housing, and Other) have been consistently increasing.",Claim,,,Shelters,Housing,The National Alliance to End Homelessness
,,"The current era reflects a renewed emphasis on Housing First, or connecting people with permanent housing as quickly as possible.",Claim,,,Housing First,Permanent housing,The National Alliance to End Homelessness
,,"Currently, 59 percent of all homeless system beds are designated for permanent housing.",Claim,,,Permanent housing,,The National Alliance to End Homelessness
,,"Nationally, the most common forms of homeless assistance are Permanent Supportive Housing (39 percent of system beds) and emergency shelter (32 percent of system beds).",Claim,,Cause,Permanent housing,Shelters,The National Alliance to End Homelessness
,,Only one type of intervention has been on the decline—transitional housing. There are 59 percent fewer beds in this category than there were in 2007.,Claim,,,Statistics,Transitional housing,The National Alliance to End Homelessness
,,<Decline in transitional housing beds> is responsible for decreases in the overall availability of temporary housing in recent years.,Claim,,Shelters,Transitional housing,,The National Alliance to End Homelessness
,,"In the lead up to the pandemic, the nationwide poverty rate had decreased for five consecutive years.",Claim,,Big picture,,,The National Alliance to End Homelessness
,,"In 2020, that streak <of nationwide poverty rate drop> ended and the number of people living in poverty spiked by approximately 3.3 million people.",Claim,,Big picture,Covid-19,,The National Alliance to End Homelessness
,,"Some doubled-up individuals and families have fragile relationships with their hosts or face other challenges in the home, putting them at risk of homelessness.",Claim,,Double up,,,The National Alliance to End Homelessness
,,"In 2020, the size of this group <doubled-up individuals> experienced an uptick after six years of decline. Currently, the doubled-up population size is 5 percent larger than it was in 2007.",Claim,,Double up,,,The National Alliance to End Homelessness
,,"Over a period lasting more than a decade, the nation has not made any real progress in reducing the number of Americans at risk of homelessness.",Claim,,Big picture,,,The National Alliance to End Homelessness
,,The trend lines in the above chart point to severe house cost and doubled-up numbers that are higher in 2020 than they were in 2007.,Claim,There is not enough affordable housing,Big picture,Housing,,The National Alliance to End Homelessness
,,"since 2007, severe-housing-cost burdened households grew by 45 percent in Wyoming and 34 percent in Connecticut (numbers that are even higher than national-level population growth)",Claim,There is not enough affordable housing,Big picture,Housing,,The National Alliance to End Homelessness
,,"Similarly, over that same time period <since 2007>, the number of people doubled up expanded by 136 percent in Nevada and 98 percent in Hawaii.

",Claim,There is not enough affordable housing,Big picture,Housing,,The National Alliance to End Homelessness
,,Data on homelessness are based on annual point-in-time (PIT) counts conducted by Continuums of Care (CoCs) to estimate the number of people experiencing homelessness on a given night.,Claim,,,Statistics,,The National Alliance to End Homelessness
,,"To end homelessness, a community-wide coordinated approach to delivering services, housing, and programs is needed.",Claim,Make different institutions coordinate their actions on solving homelessness,Big picture,Coordination,,The National Alliance to End Homelessness
,,"To address homelessness, communities should take a coordinated approach, moving from a collection of individual programs to a community-wide response that is strategic and data driven. Communities that have adopted this approach use data about the needs of those experiencing homelessness to inform how they allocate resources, services, and programs.",Claim,Make different institutions coordinate their actions on solving homelessness,Big picture,Coordination,Data,The National Alliance to End Homelessness
,,"Coordinated entry, also known as coordinated assessment or coordinated intake, is a process designed to quickly identify, assess, refer and connect people in crisis to housing and assistance, no matter where they show up to ask for help. It can pave the way for more efficient homeless assistance systems by:",Claim,Make different institutions coordinate their actions on solving homelessness,Coordinated entry,Coordination,Description,The National Alliance to End Homelessness
,,"Establishing a plan helps communities set goals and conceptualize what they should prioritize. A plan can include goals, a process and timeline for meeting those goals, and mechanisms for evaluating progress.  Planning also brings providers, government officials, Continuum of Care leads and funders together to address topics such as how to identify needs of the population, decide on the structure of coordinated assessment, integrate prevention and shelter diversion resources, map out existing assessment and intake processes and sketch out preliminary needs assessment and screening tools.",Claim,Make different institutions coordinate their actions on solving homelessness,Big picture,,,The National Alliance to End Homelessness
,,"Data collection efforts have advanced considerably in the past few decades and have opened up new opportunities and insight into homelessness in America. Collecting data and using it to inform decisions, locally and nationally, is critical to addressing homelessness",Claim,,Big picture,Data,,The National Alliance to End Homelessness
,,"A Homeless Management Information System (HMIS) is a local information technology system used to collect client, program, and system-level data on the provision of housing and services to homeless individuals and families and persons at risk of homelessness. Each Continuum of Care is responsible for operating an HMIS system according to the U.S. Department of Housing and Urban Development’s (HUD) Data Standards.",Claim,,Homeless Management Information System (HMIS),Data,Description,The National Alliance to End Homelessness
,,"(Homeless Management Information System) There are many benefits to a common and shared data system. From a client-level perspective, it contributes to a more seamless process of matching individuals, youth and families with the right resources. It can also make the comprehensive analysis of a community’s homeless system possible, which is critical to assessing incomes and ultimately improving practice and performance.",Claim,,Big picture,Data,Homeless Management Information System,The National Alliance to End Homelessness
,,Performance measures can be used by communities to examine progress and to assess what steps they should be taking to further reduce homelessness. HUD has developed system-level performance measures to help communities gauge their progress in preventing and ending homelessness.,Claim,,Big picture,Data,,The National Alliance to End Homelessness
,,"To end homelessness, a coordinated systems approach is needed. This approach requires using local data to inform decisions about how to most effectively allocate resources, services, and programs to best address the needs of those experiencing homelessness in the community.",Claim,,Coordination,Data,,The National Alliance to End Homelessness
,,Rapid re-housing can end homelessness by quickly connecting people to a home and services,Claim,,Big picture,Housing,Rapid re-housing,The National Alliance to End Homelessness
,,"Rapid re-housing provides short-term rental assistance and services. The goals are to help people obtain housing quickly, increase self- sufficiency, and stay housed. It is offered without preconditions (such as employment, income, absence of criminal record, or sobriety) and the resources and services provided are typically tailored to the needs of the person.",Claim,,Rapid re-housing,Housing,Description,The National Alliance to End Homelessness
,,Rapid re-housing is a primary solution for ending homelessness. It has been demonstrated to be effective in getting people experiencing homelessness into permanent housing and keeping them there,Claim,,Big picture,Housing,Rapid re-housing,The National Alliance to End Homelessness
,,"<Rapid re-housing> By connecting people with a home, they are in a better position to address other challenges that may have led to their homelessness, such as obtaining employment or addressing substance abuse issues. The intervention has also been effective for people traditionally perceived to be more difficult to serve, including people with limited or no income and survivors of domestic violence.",Claim,,Big picture,Housing,Rapid re-housing,The National Alliance to End Homelessness
,,"Research demonstrates that those who receive rapid re-housing assistance are homeless for shorter periods of time than those assisted with shelter or transitional housing. Rapid re-housing is also less expensive than other homeless interventions, such as shelter or transitional housing.",Claim,,Big picture,Housing,Rapid re-housing,The National Alliance to End Homelessness
,,Permanent supportive housing is a proven solution to homelessness for the most vulnerable chronically homeless people. It pairs housing with case management and supportive services.,Claim,Provide additional support on top of housing homeless people,Big picture,Housing,,The National Alliance to End Homelessness
,,"Permanent supportive housing is an intervention that combines affordable housing assistance with voluntary support services to address the needs of chronically homeless people. The services are designed to build independent living and tenancy skills and connect people with community-based health care, treatment and employment services.",Claim,Provide additional support on top of housing homeless people,Permanent supportive housing,Housing,Description,The National Alliance to End Homelessness
,,"Investments in permanent supportive housing have helped decrease the number of chronically homeless individuals by 8 percent since 2007. In addition to ending homelessness for people who are chronically homeless, research has demonstrated that permanent supportive housing can also increase housing stability and improve health.

",Claim,Provide additional support on top of housing homeless people,Chronically homeless,Housing,Permanent supportive housing,The National Alliance to End Homelessness
,,"A cost-effective solution, permanent supportive housing has been shown to lower public costs associated with the use of crisis services such as shelters, hospitals, jails and prisons.

",Claim,Provide additional support on top of housing homeless people,Permanent supportive housing,,,The National Alliance to End Homelessness
,,A crisis response system helps people exit homelessness quickly.,Claim,,Big picture,,,The National Alliance to End Homelessness
,,"The goals of an effective crisis response system are to identify those experiencing homelessness, prevent homelessness when possible, connect people with housing quickly and provide services when needed.",Claim,,Crisis response system,,Description,The National Alliance to End Homelessness
,,"Outreach: Outreach workers connect people at risk of or experiencing homelessness to coordinated entry, emergency services, and shelter. They work with other programs in the system to connect people to stable, permanent housing.",Claim,Make different institutions coordinate their actions on solving homelessness,Outreach,,Description,The National Alliance to End Homelessness
,,"Coordinated entry: Coordinated entry is a process designed to quickly identify, assess, refer and connect people in crisis to housing and assistance and services.",Claim,,Coordinated entry,,Description,The National Alliance to End Homelessness
,,"Diversion and prevention: Prevention and diversion are important components of a community’s crisis response and can help it reduce the size of its homeless population. Prevention assistance can aid households in preserving their current housing situation while diversion prevents homelessness for people seeking shelter by helping them identify immediate alternate housing arrangements and, if necessary, connecting them with services.",Claim,,Big picture,Prevention,,The National Alliance to End Homelessness
,,"Emergency shelters and interim housing: People experiencing a housing crisis or fleeing an unsafe situation need to find a place to stay, quickly. Emergency shelter and interim housing can fill this role in a crisis response system. These interventions should be low-barrier and align their goals and program activities with the larger system’s goals.",Claim,,Big picture,Shelters,,The National Alliance to End Homelessness
,,"Permanent housing: A crisis response system must have the capacity to connect people experiencing homelessness with permanent housing programs, such as rapid re-housing and permanent supportive housing, and other stable housing options.",Claim,,Big picture,Housing,,The National Alliance to End Homelessness
,,"An effective crisis response system is able to identify and quickly connect people who are experiencing or are at risk of experiencing homelessness to housing assistance and other services. It works because it aligns a community, its programs and services around one common goal — to make homelessness rare, brief, and nonrecurring.",Claim,,Crisis response system,Coordination,Description,The National Alliance to End Homelessness
,,"Programs designed to assist low-income people increase their income are critical to supporting housing stability.

",Claim,,Housing,Finance,,The National Alliance to End Homelessness
,,"A reduction in work hours, a lost job, an illness or an unexpected expense can spiral into an inability to pay the rent, an eviction, reliance on extended family for a place to stay, and, sometimes, entry into a homeless shelter.",Claim,,Big picture,Cause,,The National Alliance to End Homelessness
,,"Income support programs that can assist low-income people, such as Temporary Assistance for Needy Families (TANF) or unemployment compensation, help many people withstand economic crises",Claim,,Finance,Income,,The National Alliance to End Homelessness
,,"While some people exiting homelessness will do so with a permanent rent subsidy that can buffer them from the effects of income fluctuations, the majority must depend on income from employment or benefits to help them pay rent.",Claim,,Big picture,Finance,Income,The National Alliance to End Homelessness
,,"There are efforts to improve pathways to employment for low-skilled, entry level workers through investments in subsidized employment and programs funded under the Workforce Investment and Opportunity Act (WIOA)",Claim,,Finance,Income,,The National Alliance to End Homelessness
,,"The availability of work supports for low-income households, such as child care and transportation assistance, can also have a big impact on whether or not a household can sustain employment.",Claim,,Finance,Income,,The National Alliance to End Homelessness
,,"There are also opportunities to improve income supports programs for low-income people. As an example, TANF assistance can be made more readily accessible to families experiencing a housing crisis that might help avert homelessness for some.",Claim,,Groups,Finance,,The National Alliance to End Homelessness
,,"Training local staff in the SOAR (Supplemental Security Income/Social Security Disability Income Outreach, Access and Recovery) model can reduce the length of time eligible people with disabilities must wait before receiving Supplemental Security Income (SSI).",Claim,,Health,Finance,,The National Alliance to End Homelessness
,,The large number of car break-ins might be a driving factor in San Francisco low clearance rates for property crime.,Claim,,Big picture,Statistics,,San Francisco Chronicle
,,"It’s an unusually high number of unsheltered homeless people for a large American city (San Francisco). There is no official comparable data for 2022, but numbers collected across the U.S. in 2019 shows that, among the nation's largest cities for which there is data, only L.A. had a higher rate of unsheltered homeless people at 0.67%.",Claim,,Big picture,Shelters,Statistics,San Francisco Chronicle
,,"Unlike San Francisco, many cold weather cities have a right to shelter, and in some conditions, force people off the streets and into shelters.",Claim,,Big picture,Shelters,,San Francisco Chronicle
,,"Every two years, cities and counties across the nation conduct a federally mandated, in-person count of homeless individuals on a single night in January or February. The survey – known as the PIT count – is a snapshot of homelessness, as it doesn't capture all people who fell into homelessness throughout the year",Claim,,Big picture,Information resource,,San Francisco Chronicle
,,"The data showed that after increasing quickly from less than 5,700 in 2013 to over 8,000 in 2019, the number of homeless individuals decreased slightly to 7,800 in 2022",Claim,,Big picture,Statistics,,San Francisco Chronicle
,,"San Francisco <.> has the nation’s highest housing wage (i.e., the hourly wage a full-time worker must earn to afford a modest home at HUD’s fair market rent ).",Claim,Provide additional support on top of housing homeless people,Big picture,Housing,Supportive housing,San Francisco Chronicle
,,San Francisco Department of Health keeps track of the number of people they have offered homelessness services to throughout the year,Claim,,Big picture,Information resource,,San Francisco Chronicle
,,"Unlike San Francisco, many cold weather cities have a right to shelter, and in some conditions, force people off the streets and into shelters.",Claim,,Big picture,Statistics,,San Francisco Chronicle
,,"According to responses from a 2019 survey of homeless people identified through the PIT count, a quarter said losing a job was the primary reason they became homeless",Claim,,Big picture,Cause,,San Francisco Chronicle
,,A disproportionate share of S.F.'s homeless population is over 40.,Claim,,Big picture,Statistics,Age,San Francisco Chronicle
,,"Although 46% of S.F.'s population is over 40, that age group accounts for more than 57% of homeless people.",Claim,,Big picture,Statistics,Age,San Francisco Chronicle
,,"Studies have found that older adults in low-income jobs often haven't been able to save money, and when hard times hit, end up on the streets.",Claim,,Big picture,Cause,Age,San Francisco Chronicle
,,Black people are about ten times as likely to be homeless as white people in the city <San Francisco>.,Claim,,Big picture,Groups,,San Francisco Chronicle
,,People without housing typically face an unusual number of health issues.,Claim,,Big picture,Health,,San Francisco Chronicle
,,"According to DPH data, substance abuse, depression and alcoholism were the top three medical issues among the people who accessed homelessness services in 2019.",Claim,,Big picture,Health,,San Francisco Chronicle
,,A disproportionate share of San Francisco homeless population is over 40.,Claim,,Big picture,Statistics,,San Francisco Chronicle
,,The city has allocated more and more funding toward homelessness since 2016,Claim,,Big picture,Funding,,San Francisco Chronicle
,,"In 2021, COVID-19 Fema funding and relief grants contributed to the budget’s largest homelessness investment yet at $1.1 billion.",Claim,,Big picture,Funding,,San Francisco Chronicle
,,Housing costs for San Francisco residents are among the highest in the world.,Claim,There is not enough affordable housing,Housing,,,San Francisco Chronicle
,,"Similar-size cities such as Seattle, Denver and Austin, Texas, have approved construction for three to four times as many residential units as San Francisco since 2015, according to U.S. census building permit data.",Claim,There is not enough affordable housing,Housing,Housing,,San Francisco Chronicle
,,"From 2015 to 2021, <San Francisco> permitted 24,600 units to be built, a little over 3,500 units annually.",Claim,Build more affordable housing,Housing,,,San Francisco Chronicle
,,"According to the latest 2014 Housing Element, S.F. needs to build 82,000 new units from 2023 to 2030, which means building more than 10,000 units per year starting in 2023. That’s almost triple the city’s recent pace.",Claim,Build more housing units,Housing,Statistics,,San Francisco Chronicle
,,"When compared with other fast-growing tech hubs like Austin and Seattle, the difference in San Francisco building permit approval rate was particularly stark <low>",Claim,Not enough building permits are being issued,Housing,,,San Francisco Chronicle
,,"<July 2022, the Chronicle survey 1,653 San Francisco residents which problem in the city needed to be addressed most urgently>. When broken down by race, respondents who identify as Asian were the most likely to cite safety and crime as the most urgent issue in San Francisco. Black respondents were the least likely to say crime and safety, but were the most likely to say homelessness.",Claim,,Housing,Statistics,,San Francisco Chronicle
,,"The data shows that two-thirds of San Francisco units are either single family homes or in buildings with more than 20 units, according to 2021 data.",Claim,Not enough high density buildings,Housing,Statistics,,San Francisco Chronicle
,,"In recent years, however, the city has mostly built large housing structures. 89% of all units added in 2021 were with more than 20 units, which is typical of the past several years of building in the city.",Claim,,Housing,Statistics,,San Francisco Chronicle
,,"To maximize profit, developers are incentivized to buy land and build residential buildings that can house many tenants.",Claim,,Housing,,,San Francisco Chronicle
,,San Francisco current housing stock does not have many units that are affordable.,Claim,There is not enough affordable housing,Housing,,,San Francisco Chronicle
,,"Only 9% of the current units in S.F. are affordable, according to early documentation of the city’s housing needs assessment.",Claim,There is not enough affordable housing,Housing,Statistics,,San Francisco Chronicle
,,"When compared with other fast-growing tech hubs like Austin and Seattle, the difference in San Francisco building permit approval rate was particularly stark <low>",Claim,Not enough building permits are being issued,Housing,Statistics,,San Francisco Chronicle
,,<2018 to 2021> San Francisco portion of <permitted> affordable housing is midtier compared with other major cities in California.,Claim,,Housing,Statistics,,San Francisco Chronicle
,,Among the ways policymakers are promoting new housing is allowing property owners to make alterations to their existing buildings that create new units,Claim,,Housing,,,San Francisco Chronicle
,,"<Building> alterations have contributed an increasing number of units to the <San Francisco> housing stock since 2017.
",Claim,,Housing,,,San Francisco Chronicle
,,Accessory dwelling units are the most common type of alteration <in San Francisco>,Claim,,Housing,,,San Francisco Chronicle
,,ADUs are small additional units constructed on the property of an existing home and were developed to address growing housing demands in San Francisco.,Claim,,Housing,Description,,San Francisco Chronicle
,,"Senate Bill 9 made it easier for homeowners to split their lots and convert their homes into duplexes.
",Claim,,Housing,,,San Francisco Chronicle
,,Homeowners looking to build <new units of housing> <under SB9> on their lot have faced challenges like immense fees and lack of knowledge to navigate the legal process.,Claim,,Housing,,,San Francisco Chronicle
,,"The housing production process begins when a building permit application for a project is filed with the city. If the application is accepted by the department, it receives authorization, or “entitlement,” to begin the next phase of the development process.",Claim,,Housing,Description,,San Francisco Chronicle
,,"The number of < building permit application in San Francisco> filings fell from 2015 to 2020, and entitlements in 2021 were at their lowest point in the past seven years.
",Claim,,Housing,Housing,,San Francisco Chronicle
,,"So far, 2022 is not looking like a good year. <San Francisco> is on track to build fewer than 3,000 homes.",Claim,,Housing,Housing,,San Francisco Chronicle
,,"Rising construction costs and challenging affordability requirements have stymied building, according to developers",Claim,,Housing,,,San Francisco Chronicle
,,"Compared with other major U.S. cities, S.F. boasts lower-than-average rates of violent crime",Claim,,Crime,,,San Francisco Chronicle
