ID,,TEXT,Types,Related to,Is about,Is about,Is about,Author
,,"The nation is currently facing one of the most severe affordable housing crises in history. Not surprisingly, those living in poverty are the most significantly affected.",Claim,There is not enough affordable housing,Big picture,Housing,,The National Alliance to End Homelessness
,,"But by the mid-1980s, the supply of low-cost housing had shrunk significantly. Since then, rents have continued to rise and lower-income people in particular have experienced slow or stagnant wage growth..",Claim,There is not enough affordable housing,Big picture,Housing,,The National Alliance to End Homelessness
,,"The solution to homelessness is straightforward: housing. By connecting people experiencing homelessness to housing and services, they have a platform from which they can address other areas that may have contributed to their homelessness — such as employment, health, and substance abuse.",Claim,,Big picture,Housing,,The National Alliance to End Homelessness
,,"Housing model. Permanent supportive housing: Permanent supportive housing pairs long-term rental assistance with supportive services. It is targeted to individuals and families with chronic illnesses, disabilities, mental health issues, or substance use disorders who have experienced long-term or repeated homelessness.",Claim,Provide additional support on top of housing homeless people,Permanent supportive housing,Housing,Description,The National Alliance to End Homelessness
,,"<Housing Model>. Rapid re-housing provides short-term rental assistance and services. The goals are to help people obtain housing quickly, increase self-sufficiency, and stay housed.+",Claim,,Rapid re-housing,Housing,Description,The National Alliance to End Homelessness
,,"Administered by HUD, public housing and voucher programs provide decent and safe affordable housing for low-income people and play a critical role in reducing homelessness.",Claim,Rent public housing and issue housing vouchers to homeless people,Housing,Housing,,The National Alliance to End Homelessness
,,Housing Choice Voucher Program (commonly known as “Section 8“) has become the dominant form of federal housing assistance,Claim,,Housing,Housing,Housing vouchers,The National Alliance to End Homelessness
,,"The program, which provides vouchers to low-income households to help them pay for housing in the private market, has been found to sharply reduce homelessness.",Claim,,Housing,Housing,Housing vouchers,The National Alliance to End Homelessness
,,"Public housing is federally-funded housing that is rented at subsidized rates to eligible low-income families, the elderly, and persons with disabilities.",Claim,Rent public housing and issue housing vouchers to homeless people,Public housing,Housing,Description,The National Alliance to End Homelessness
,,"While both public housing and housing vouchers are proven to end homelessness, only one in four households that are eligible for such assistance receive it due to lack of funding.",Claim,There is not enough funding for proven homelessness solutions,Housing,Housing,,The National Alliance to End Homelessness
,,"In many places across America, there is simply not enough available affordable housing. Without this housing stock, many homeless Americans are likely to continue to cycle in and out of homelessness.",Claim,There is not enough affordable housing,Big picture,Housinh,,The National Alliance to End Homelessness
,,"The priority now must be to expand the supply of affordable housing. To do this, there is a need to increase HUD’s ability to serve and house low-income individuals.",Claim,Build more affordable housing,Housing,Housing,,The National Alliance to End Homelessness
,,"Low-income households are typically unemployed or underemployed due to a number of factors, such as a challenging labor market; limited education; a gap in work history; a criminal record; unreliable transportation or unstable housing; poor health or a disability.",Claim,,Employment,,,The National Alliance to End Homelessness
,,"For those who are low-income but employed, wages have been stagnant and have not kept pace with expensive housing costs. The typical American worker has seen little to no growth in his/her weekly wages over the past three decades. Too little income combined with the dwindling availability of low-cost housing leaves many people at risk for becoming homeless.",Claim,There is not enough affordable housing,Housing,,,The National Alliance to End Homelessness
,,Those who are homeless face significant obstacles to finding and maintaining employment.,Claim,,Big picture,,,The National Alliance to End Homelessness
,,"Job training and placement programs, such as those funded by the federal government, also provide the tools some people need to secure stable, long-term employment",Claim,,Employment,Job training,,The National Alliance to End Homelessness
,,"Improving access to supportive services, such as childcare subsidies and transportation assistance, would also go a long way in helping people stay employed, achieve housing stability and remain housed.",Claim,Provide additional support on top of housing homeless people,Housing,,,The National Alliance to End Homelessness
,,"Many of those who experience homelessness are unable to work due to a disability, or are not able to quickly earn the money they need for rent",Claim,,Big picture,,,The National Alliance to End Homelessness
,,"Some individuals may be able to receive cash assistance from Supplemental Security Income (SSI), Temporary Assistance for Needy Families (TANF) or similar programs described below.",Claim,,Finance,Support,,The National Alliance to End Homelessness
,,Health and homelessness are inextricably linked,Claim,,Health,,,The National Alliance to End Homelessness
,,An acute physical or behavioral health crisis or any long-term disabling condition may lead to homelessness,Claim,,Big picture,Health,,The National Alliance to End Homelessness
,,"According to the U.S. Department of Housing and Urban Development, people living in shelters are more than twice as likely to have a disability compared to the general population.",Claim,,Health,,,The National Alliance to End Homelessness
,,"(2017) 20 percent of the homeless population reported having a serious mental illness, 16 percent conditions related to chronic substance abuse",Claim,,Health,,,The National Alliance to End Homelessness
,,"Conditions such as diabetes, heart disease, and HIV/AIDS are found at high rates among the homeless population, sometimes three to six times higher than that of the general population.",Claim,,Health,,,The National Alliance to End Homelessness
,,"Also, more than 10 percent of people who seek substance abuse or mental health treatment in our public health system are homeless.",Claim,,Health,,,The National Alliance to End Homelessness
,,"The issue of opioid abuse has risen to a level of national crisis as the number of people abusing prescription drugs and heroin has dramatically risen, and the rate of opioid-related overdose deaths has tripled since 2000",Claim,,Health,Drugs,,The National Alliance to End Homelessness
,,The drug epidemic's effects are felt in unique and notably harmful ways by people who are experiencing homelessness,Claim,,Health,Drugs,,The National Alliance to End Homelessness
,,"Substance use disorders are known risk factors for homelessness, and substance abuse and overdose disproportionately impact homeless people.",Claim,,Health,Drugs,,The National Alliance to End Homelessness
,,Treatment and preventive care can be difficult to access for people who are experiencing homelessness. This is often because they lack insurance or have difficulty engaging health care providers in the community.,Claim,,Health,,,The National Alliance to End Homelessness
,,"Most communities have Federally Qualified Health Centers and more specifically, Health Care for the Homeless Clinics, which provide some basic health services without substantial cost",Claim,,Health,,,The National Alliance to End Homelessness
,,The advent of the Affordable Care Act has also opened up options by allowing states to expand their Medicaid programs to cover people with very low incomes.,Claim,,Health,Support,,The National Alliance to End Homelessness
,,"When housing is a platform, people with a substance abuse disorder who are experiencing homelessness have the opportunity to engage in treatment fully without the additional stress of living on the streets.",Claim,,Health,Housing,,The National Alliance to End Homelessness
,,"For chronically homeless people, the intervention of permanent supportive housing provides stable housing coupled with supportive services as needed – a cost-effective solution to homelessness for those with the most severe health, mental health and substance abuse challenges.",Claim,Provide additional support on top of housing homeless people,Health,Permanent supportive housing,Chronically homeless,The National Alliance to End Homelessness
,,"A domestic violence experience is common among youth, single adults, and families who become homeless",Claim,,Domestic Violence,,,The National Alliance to End Homelessness
,,"For many, domestic violence is the immediate cause of their homelessness",Claim,,Big picture,Domestic Violence,,The National Alliance to End Homelessness
,,Survivors of domestic violence may turn to homeless service programs seeking a safe temporary place to stay after fleeing an abusive relationship,Claim,,Domestic Violence,,,The National Alliance to End Homelessness
,,Survivors may turn to homeless service programs primarily because they lack the economic resources to secure or maintain housing after leaving an abusive relationship.,Claim,,Finance,Domestic Violence,,The National Alliance to End Homelessness
,,"On a single night homeless services providers had more than 48,000 beds set aside for survivors of domestic violence(2019)",Claim,,,Domestic Violence,,The National Alliance to End Homelessness
,,The immediate need of a survivor fleeing domestic violence is safety,Claim,,Big picture,Domestic Violence,,The National Alliance to End Homelessness
,,Some domestic violence survivors may be able to safely stay in their own home with some additional financial support through rental assistance while others may require a stay in an emergency shelter or transitional housing program before re-entering their own independent housing.,Claim,,Domestic Violence,Support,,The National Alliance to End Homelessness
,,Short- or long-term rental assistance can be used to help domestic violence survivors exit shelter and regain housing,Claim,,Domestic Violence,Support,,The National Alliance to End Homelessness
,,"Having an affordable place to call home is crucial for this population <domestic violence victims>, to both reduce their risk of homelessness as well as the possibility of future violence",Claim,,Domestic Violence,Housing,,The National Alliance to End Homelessness
,,"In 2021, the Coronavirus pandemic interrupted homelessness data collection, specifically the Point-in-Time Count. Thus, the current version of the State of Homelessness reflects limited updates as compared to the previous year. Since 2020 was the last year for which full Point-in-Time data is available, the analysis and charts focused on that year continue to be highlighted here. Updated and new sections are flagged in the report’s subheadings.",Claim,,,Covid-19,Data,The National Alliance to End Homelessness
,,"In January 2020 , there were 580,466 people experiencing homelessness on our streets and in shelters in America",Claim,,Big picture,Statistics,,The National Alliance to End Homelessness
,,"<2022> Most <homeless> were individuals (70 percent), and the rest were people in families with children.",Claim,,Big picture,Statistics,,The National Alliance to End Homelessness
,,Decision-makers are often concerned about children and young people due to their developmental needs and the potential life-long consequences of hardships in early in life,Claim,,Policy,,,The National Alliance to End Homelessness
,,People in families with children make up 30 percent of the homeless population.,Claim,,Big picture,Statistics,,The National Alliance to End Homelessness
,,Unaccompanied youth (under age 25) account for six percent of the larger group.,Claim,,Big picture,Statistics,,The National Alliance to End Homelessness
,,People experiencing “chronic homelessness” belong to another group that is often singled out for attention.,Claim,,Big picture,Chronically homeless,Chronically homeless,The National Alliance to End Homelessness
,,<chronic homelessness> have disabilities and have also: 1) been continuously homeless for at least a year; or 2) experienced homelessness at least four times in the last three years for a combined length of time of at least a year.,Claim,,Chronically homeless,,,The National Alliance to End Homelessness
,,Chronically homeless individuals are currently 19 percent of the homeless population.,Claim,,Chronically homeless,Statistics,,The National Alliance to End Homelessness
,,"Due to their service to our country, veterans are often analyzed separately from the larger group",Claim,,Data,Veterams,,The National Alliance to End Homelessness
,,Veterans represent only six percent of people experiencing homelessness.,Claim,,Veterans,Statistics,,The National Alliance to End Homelessness
,,"<Homelessness> risk is significantly tied to gender, race, and ethnicity.",Claim,,Big picture,Groups,,The National Alliance to End Homelessness
,,Males are far more likely to experience homelessness than their female counterparts,Claim,,Males,,,The National Alliance to End Homelessness
,,"Out of every 10,000 males, 22 are homeless.",Claim,,Males,Statistics,,The National Alliance to End Homelessness
,,"Out of every 10,000 women and girls 13 are homeless.",Claim,,Females,Statistics,,The National Alliance to End Homelessness
,,When the focus is solely on Individuals (the most significant subgroup within homelessness). The overwhelming majority (70 percent) are men.,Claim,,Data,Statistics,Males,The National Alliance to End Homelessness
,,Historically marginalized groups are more likely to be disadvantaged within housing and homelessness spheres,Claim,,Groups,,,The National Alliance to End Homelessness
,,"Higher unemployment rates, lower incomes, less access to healthcare, and higher incarceration rates are some of the factors likely contributing to higher rates of homelessness among people of color.",Claim,,Groups,Cause,,The National Alliance to End Homelessness
,,"The reasons for the disparities <in homelessness>  are many and varied but tend to fall under the umbrellas of racism and caste. Throughout American history, private actors have contributed to the status quo, but so has government via actions and inactions resulting in limited housing opportunities, suppressed wages, and other unhelpful outcomes.",Claim,,Groups,Cause,,The National Alliance to End Homelessness
,,"Native Hawaiians and other Pacific Islanders have the highest rate of homelessness (109 out of every 10,000 people)",Claim,,Groups,Statistics,,The National Alliance to End Homelessness
,,"Groups such as Native Americans (45 out of every 10,000 <are homeless>)",Claim,,Groups,Statistics,,The National Alliance to End Homelessness
,,"Black or African Americans (52 out of every 10,00 <are homeless>)",Claim,,Groups,Statistics,,The National Alliance to End Homelessness
,,"<USA> overall rate of homelessness is 18 out of every 10,000.",Claim,,Big picture,Statistics,,The National Alliance to End Homelessness
,,"The nation has a system of temporary shelters that reaches 354,000 people on a given night.",Claim,,Support,Statistics,,The National Alliance to End Homelessness
,,"some <homeless people> sleep in locations not ordinarily designated for that purpose (for example, sidewalks, subway trains, vehicles, or parks).",Claim,,Big picture,Shelters,,The National Alliance to End Homelessness
,,"Unsheltered people are considered particularly vulnerable due to their exposure to the elements and lack of safety, among other things.",Claim,,Big picture,Shelters,,The National Alliance to End Homelessness
,,Homeless programs and systems provide shelter for most people experiencing homelessness (61 percent in 2020 ).,Claim,,Support,Shelters,Statistics,The National Alliance to End Homelessness
,,"Children are often a priority for homeless services systems. As a result, families with children are least likely to be unsheltered (only ten percent of unsheltered people were living in families with children).",Claim,,Policy,Shelters,,The National Alliance to End Homelessness
,,"However, young people not living with their families do not enjoy the same access to services—50 percent of unaccompanied homeless youth in 2020 were unsheltered.",Claim,,Big picture,Shelters,Statistics,The National Alliance to End Homelessness
,,Individuals experiencing homelessness on their own are particularly at risk of being unsheltered.,Claim,,Individuals,Shelters,,The National Alliance to End Homelessness
,,"In 2020, for the first time since data collection began, the majority of those who were homeless as Individuals (51 percent) were unsheltered.",Claim,,Big picture,Statistics,Individuals,The National Alliance to End Homelessness
,,Chronically homeless (66 percent living without any shelter at all),Claim,,Chronically homeless,Statistics,Shelters,The National Alliance to End Homelessness
,,"The most recently available nationwide unsheltered data are from the 2020 Point-in-Time Count. Pandemic-related health concerns disrupted counts of unsheltered people in 2021. While some CoCs made such data available for that year, the nationwide count will not be fully updated until late 2022 or early 2023, leaving a significant hole in available knowledge on homelessness.",Claim,,Data,Statistics,,The National Alliance to End Homelessness
,,"Between 2019 and 2020, homelessness nationwide increased by two percent. This change marked the fourth straight year of incremental population growth.",Claim,,Big picture,Statistics,,The National Alliance to End Homelessness
,,"Previously, homelessness had primarily been on the decline, decreasing in eight of the nine years before <2019> the current trend began",Claim,,Big picture,,,The National Alliance to End Homelessness
,,"Long-term progress <on homelessness> has been modest. In 2020, the number of unhoused people was only 10 percent lower than in 2007 (the first year of nationwide data collection).",Claim,,Big picture,Statistics,,The National Alliance to End Homelessness
,,"While overall progress on ending homelessness has been modest, there is significant variation among subgroups. Some have experienced striking reductions in their counts.",Claim,,Groups,,,The National Alliance to End Homelessness
,,"Currently, 83 communities and 3 states have announced that they ended veteran homelessness (meaning that systems can ensure that homelessness is rare, brief, and one-time).",Claim,,Big picture,,Veterans,The National Alliance to End Homelessness
,,"Nationally, veteran homelessness decreased 47 percent since the point at which it peaked in 2009.",Claim,,Veterans,Statistics,,The National Alliance to End Homelessness
,,Homeless families with children are another group that decreased in size — 27 percent between 2007 and 2020.,Claim,,,Statistics,,The National Alliance to End Homelessness
,,"Before homelessness began increasing again in 2016, chronic individual homelessness dropped by 35 percent since 2007.",Claim,,,Statistics,Chronic individual,The National Alliance to End Homelessness
,,"Some subpopulations <which experienced more progress on homelessness> have benefitted from greater attention and/or resources after being prioritized by national-, state-, and local-level stakeholders. However, factors external to homeless services systems also contribute to outcomes. Regardless, these subgroups provide proof that significant reductions in homelessness are possible and have occurred.",Claim,,,,,The National Alliance to End Homelessness
,,"The number of individuals experiencing homelessness has remained static over time, decreasing by a mere 1 percent between 2007 and 2020.",Claim,,Individuals,Statistics,,The National Alliance to End Homelessness
,,"Although most veterans and chronically homeless people fall under the umbrella category of “individuals,” the majority of individuals do not belong to one of these subgroups. As a result, individual homeless adults who are not veterans or chronically homeless have typically not been the focus of special attention or resources.",Claim,,Individuals,Cause,,The National Alliance to End Homelessness
,,"The size of this group < individuals experiencing chronically homelessness> had decreased significantly in the period before 2016. However, between 2016 and 2020, their numbers have surged by 43 percent.",Claim,,Individuals,Statistics,,The National Alliance to End Homelessness
,,"Since data on homelessness has been collected, unsheltered homelessness has largely trended downward. By 2015, it had dropped by nearly a third.",Claim,,Big picture,Statistics,,The National Alliance to End Homelessness
,,"Between 2015 and 2020, there was a reversal of that <positive> trend. The unsheltered population surged by 30 percent , almost wiping out nearly a decade of reductions. The number of people currently living unsheltered was virtually as high as it was in 2007.",Claim,,Big picture,Statistics,,The National Alliance to End Homelessness
,,"The rising trend of unsheltered homelessness impacts nearly every major subgroup—including people of every race, ethnicity, gender, and most age groups.",Claim,,Big picture,,,The National Alliance to End Homelessness
,,Only children (people under 18) have realized an overall decrease in unsheltered homelessness during the surge that was evident at least through 2020.,Claim,,,Statistics,Children,The National Alliance to End Homelessness
,,"While unsheltered homelessness was on the rise during the period leading up to the pandemic, fewer and fewer people were staying in shelters. The downward trend in shelter usage continued into 2021.",Claim,,Big picture,Shelters,,The National Alliance to End Homelessness
,,"An easy assumption would be that systems are failing—that they’re providing fewer people with shelter, leaving more and more people to sleep outside. However, the reality is much more complicated.",Claim,,,,,The National Alliance to End Homelessness
,,"Overall, homeless services systems have actually increased their capacity to serve people. systems have been steadily growing their available bed numbers.",Claim,,,Shelters,,The National Alliance to End Homelessness
,,"<homeless services systems> have been increasingly focusing their resources on permanent housing rather than temporary shelter. Thus, more and more people may be benefitting from housing and services, but an increasing share is living in permanent housing as opposed to languishing in temporary shelters",Claim,,,Housing,Shelters,The National Alliance to End Homelessness
,,"Growth in overall bed numbers is likely failing to keep pace with the number of new people entering homelessness, and specifically unsheltered homelessness.",Claim,,Shelters,,,The National Alliance to End Homelessness
,,"HUD’s AHAR Part 1: Point-in-Time Estimates of the Sheltered Homelessness (February 2022) highlights some COVID-19-related factors that likely contributed to decreases the size of the sheltered population between 2020 and 2021. These include:

reduced shelter capacity due to social distancing requirements, and
reduced inflow into shelters tied to eviction moratoria and stepped-up investments in homelessness prevention and diversion.
",Claim,,,Selters,Covid-19,The National Alliance to End Homelessness
,,Locating the areas experiencing the most significant <homelessness> challenges and directing additional attention – including new resources – towards them could result in meaningful reductions in homelessness.,Claim,,Big picture,Data,,The National Alliance to End Homelessness
,,"Fifty-seven percent of people experiencing homelessness in 2020 were in five states (California, New York, Florida, Texas, and Washington ).",Claim,,Big picture,Statistics,,The National Alliance to End Homelessness
,,"Significant share of this national challenge <homelessness> is in a small number of places with large homeless counts. Meanwhile, most communities have relatively small homeless populations to serve. This should impact how the problem is addressed.",Claim,,Big picture,,,The National Alliance to End Homelessness
,,Many of the states and CoCs with the highest rates of homelessness have the highest housing costs.,Claim,,Big picture,,,The National Alliance to End Homelessness
,,"San Francisco <.> has the nation’s highest housing wage (i.e., the hourly wage a full-time worker must earn to afford a modest home at HUD’s fair market rent ).",Claim,,,,,The National Alliance to End Homelessness
,,"CoCs like Humboldt and Imperial City in California are listed above among the ten CoCs with the highest rates of homelessness in the country. They also have high poverty rates, exceeding 20 percent of their overall populations. Such jurisdictions have relatively low housing costs but have many people experiencing economic hardships, some resulting in homelessness.",Claim,,Big picture,,,The National Alliance to End Homelessness
,,The nation’s homeless services systems do not have enough resources to fully meet the needs of everyone experiencing homelessness.,Claim,,Big picture,,,The National Alliance to End Homelessness
